Index,Taxon,Name_in_tree,Clade,Subclade,Subclade_2,Max_age,Min_age,FL,FC,FML,FAP,TL_TLE,TC,HL,HC,HML,HAP,RC,RL_RLE,MtL,Source,Age/notes,Juvenile,Bonebed,Institution,Specimen,FCoval,HCoval,FCe,FCe_meserr,FCe_method,HCe,HCe_meserr,HCe_method,Mass,Mass_lse (log10)
707,Archaeoceratops_oshimai,Archaeoceratops_oshimai,Ornithischia,Ceratopsia,Ceratopsia_2,Barremian,Aptian,,,,,,,,,,,,,,You and Dodson 2003; holotype IVPP V 11114,no complete limb bones for either type or paratype; MTIII from juvenile paratype V 11115 (68 mm),0,0,"IVPP, Institute of Vertebrate Paleontology and Paleoanthropology, Beijing, China",IVPP V 11114,,,,,,,,,,
708,Archaeoceratops_yujingziensis,Archaeoceratops_yujingziensis,Ornithischia,Ceratopsia,Ceratopsia_2,Aptian,Albian,102,,12,12.5,,,,,,,,,,You et al 2010; CAGS-IG-VD-003,unfused neurocentral sutures suggests an immature individual,1,0,"CAGS, Chinese Academy of Geological Sciences, Institute of Geology, Beijing, China",CAGS-IG-VD-003,38.49,,41.58,0.0249,FC_for_all_dinosaurs_using_FCoval_and_equation_.4.,26.95,0.055482995,HC_for_quadrupedal_ceratopsians_using_FCe,8.769754163,0.222089721
709,Arenysaurus_ardevoli,Arenysaurus_ardevoli,Ornithischia,Hadrosauroidea,Hadrosauroidea,Late_Maastrichtian,Late_Maastrichtian,711,,,,,,,,56,38,,,,Pereda-Suberbiola et al 2009,"Associated skeleton, may be one individual; mature; Pereda-Suberbiola et al 2009",0,0,"MPZ, Museo Paleontológico de la Universidad de Zaragoza, Gobierno de Aragón, Zaragoza, Spain",MPZ 2008/336 and 337,,149.01,264.02,0.0418,FC_for_quadrupedal_iguanodontians_using_FL_and_equation_.30.,155.62,0.0203,HC_for_all_dinosaurs_using_HCoval_and_equation_.5.,1278.4147,0.237412235
710,Arrhinoceratops_brachyops,Arrhinoceratops_brachyops,Ornithischia,Ceratopsidae,Ceratopsidae,Late_Campanian,Early_Maastrichtian,,,,,,,,,,,,,,Lull 1933,mature,0,0,"ROM, Royal Ontario Museum, Toronto, Canada",ROM 5135,,,,,,,,,,
711,Asiaceratops_salsopaludalis,Asiaceratops_salsopaludalis,Ornithischia,Ceratopsia,Ceratopsia_3,Early_Cenomanian,Early_Cenomanian,,,,,87.8,,,,,,,,,Chinnery 2004b,Maxilla length = 5 cm (Nessov 1989; TsNIGRI 496/12457); ontogenetic status unknown,0,0,ZIN,ZIN 8a,,,,,,,,,,
712,Auroraceratops_rugosus,not,Ornithischia,Ceratopsia,Ceratopsia_2,Barremian,Albian,,,,,,,,,,,,,,You et al. 2005a,no limbs,0,0,"IG, Institute of Geology, Chinese Academy of Geological Sciences, Beijing, China",IG-2004-VD-001,,,,,,,,,,
713,Bactrosaurus_johnsoni,Bactrosaurus_johnsoni,Ornithischia,Hadrosauroidea,Hadrosauroidea,Middle_Campanian,Late_Campanian,796,339,118,103,655,246,,136,,,,,240,pers. obs. NEC/MTC,mature,0,0,"AMNH, American Museum of Natural History, New York, USA",AMNH 6553,347.55,,339,0,measured,136,0,measured,1797.338221,0.151472561
714,Bagaceratops_rozhdestvenskyi,Bagaceratops_rozhdestvenskyi,Ornithischia,Ceratopsia,Ceratopsia_3,Late_Campanian,Late_Campanian,103,,,,120,,79.5,,,,,61,65,MPC-D 100/506 (NEC),ontogenetic stage unknown,0,0,"MPC, Mongolian Paleontological Center, Mongolian Academy of Sciences,
Ulaanbaatar, Mongolia",MPC-D 100/506,,,42.38,0.0563,FC_for_quadrupedal_dinosaurs_using_FL_and_equation_.16.,16.08,0.0903,HC_for_quadrupedal_ceratopsians_using_HL_and_equation_.29.,5.665337904,0.331278907
715,Barilium_dawsoni,Barilium_dawsoni,Ornithischia,Iguanodontia,Iguanodontia,Valanginian,Valanginian,905,460,,,,,,,,,,,,BMNH M2848 (DCE),mature; large size: Blows 1998,0,0,"BMNH, Natural History Museum, London, United Kingdom",BMNH M2848,,,460,0,measured,,,,,
716,Barsboldia_sicinskii,Barsboldia_sicinskii,Ornithischia,Hadrosauroidea,Hadrosauroidea,Late_Campanian,Early_Maastrichtian,,,,,,,,,,,,,,Prieto-Marquez 2011,mature; Prieto-Marquez 2011,0,0,"ZPAL, Institute of Paleobiology of the Polish Academy of Sciences, Warsaw, Poland",ZPAL MgD-I/110,,,,,,,,,,
717,Batyrosaurus_rozhdestvenskyi,not,Ornithischia,Hadrosauroidea,Hadrosauroidea,Santonian,Campanian,,,,,,,,,,,,,,Godefroit et al. 2012a,unfused neurocranial sutures suggest immaturity,1,0,"AEHM,Palaeontological Museum of the Institute of Geology and Nature Management, Far East Branch, Russian Academy of Sciences, Blagoveschensk, Russia",AEHM 4/1,,,,,,,,,,
718,Bissektipelta_archibaldi,not,Ornithischia,Ankylosauria,Ankylosauria,Late_Turonian,Late_Turonian,,,,,,,,,,,,,,Parish and Barrett 2004,partial braincase and skull roof,0,0,"ZIN PH, Paleoherpetological Collection, Zoological Institute, Russian Academy of Sciences, St. Petersburg, Russia",ZIN PH 1/16,,,,,,,,,,
719,Blasisaurus_canudoi,Blasisaurus_canudoi,Ornithischia,Hadrosauroidea,Hadrosauroidea,Late_Maastrichtian,Late_Maastrichtian,,,,,,,,,,,,,,Cruzado-Caballero et al. 2010,no limbs; dentary length 340mm; mature; Cruzado-Caballero et al 2010,0,0,"MPZ, Museo Paleontológico de la Universidad de Zaragoza–Gobierno de Aragón, Zaragoza, Spain",MPZ 99/665,,,,,,,,,,
720,Bolong_yixianensis,not,Ornithischia,Hadrosauroidea,Hadrosauroidea,Late_Barremian,Early_Aptian,,,,,510,,,,,,,198,,Wu et al 2010,ontogenetic stage unknown,0,0,YHZ,YHZ-001,,,,,,,,,,
721,Brachylophosaurus_canadensis,Brachylophosaurus_canadensis,Ornithischia,Hadrosauroidea,Hadrosauroidea,Middle_Campanian,Middle_Campanian,1295,440,,149,1140,,585,221,,,,705,435,MOR 794 (postcrania) CMN 8893 (skull) (NEC; Liz Freedman pers. comm. 10 June 2014; Cuthberston & Holmes 2010); Individuals of very similar size (HC = 221 and 225 respectively),mature,0,0,"MOR, Museum of the Rockies, Bozeman, Montana, USA",MOR 794,,,440,0,measured,221,0,measured,4458.360488,0.151736407
722,Callovosaurus_leedsi,Callovosaurus_leedsi,Ornithischia,Iguanodontia,Iguanodontia,Middle_Callovian,Middle_Callovian,300,101,26,29,,,,,,,,,,BMNH R1993 (RBJB),,0,0,"BMNH, Natural History Museum, London, United Kingdom",BMNH R1993,86.46,,101,0,measured,,,,,
723,Camptosaurus_dispar,Camptosaurus_dispar,Ornithischia,Iguanodontia,Iguanodontia,Kimmeridgian,Tithonian,630,275,107.9,80.3,520,203,370,150,47.5,39.8,84,222,199.6,ROM 5090 (NEC),adult; similar in size to adult figured by Carpenter & Wilson 2008,0,0,"ROM, Royal Ontario Museum, Toronto, Canada",ROM 5090,297.22,137.4,275,0,measured,150,0,measured,1323.811075,0.15084785
724,Cedarpelta_bilbeyhallorum,Cedarpelta_bilbeyhallorum,Ornithischia,Ankylosauria,Ankylosauria,Late_Albian,Early_Cenomanian,,,,,,,,,,,,,,Carpenter et al. 2001,"Estimated skull length. Total body length estimated at 7.5-8.5 m; right
partial humerus CEUM 10258; left ulna CEUM 10425; mature; Carpenter et al 2001",0,0,"CEUM, College of Eastern Utah Prehistoric Museum, Price, Utah, USA",CEUM 12360,,,,,,,,,,
725,Cedrorestes_crichtoni,Cedarorestes_crichtoni,Ornithischia,Iguanodontia,Iguanodontia,Barremian,Barremian,,,,,639,,,,,,,,219,Gilpin et al. 2007; DMNH 47994,"tib and MT III complete, but lengths not reported; lengths taken with imagej",0,0,"DMNH, Denver Museum of Nature and Science, Denver, Colorado, UK",DMNH 47994,,,,,,,,,,
726,Centrosaurus_apertus,Centrosaurus_apertus,Ornithischia,Ceratopsidae,Ceratopsidae,Campanian,Campanian,795,286,84.8,99.3,520,268,563,249,99,,,,206,YPM 2015 (NEC),Skull length from Lull (1933); mature,0,0,"YPM, Yale Peabody Museum, New Haven, Connecticut, USA",YPM 2015,289.63,,286,0,measured,249,0,measured,2492.635914,0.151779904
727,Centrosaurus_brinkmani,Centrosaurus_brinkmani,Ornithischia,Ceratopsidae,Ceratopsidae,Middle_Campanian,Middle_Campanian,,,,,,,,,,,,,,Ryan & Russell 2005,mature,0,0,"TMP, Royal Tyrrell Museum of Paleontology, Drumheller, Canada",TMP 2002.68.1,,,,,,,,,,
728,Cerasinops_hodgskissi_,Cerasinops_hodgskissi,Ornithischia,Ceratopsia,Ceratopsia_2,Middle_Campanian,Late_Campanian,352,,,36,344.6,,260.3,,30,28,,175,170.7,Chinnery and Horner 2007,basal length=240; total length (including frill)=355 (based on reconstruction in Fig. 1); adult (Chinnery and Horner 2007),0,0,"MOR, Museum of the Rockies, Bozeman, Montana, USA",MOR 300,,91.13,122.44,0.0435,FC_for_quadrupedal_ceratopsians_using_HL_and_equation_.27.,94.77,0.0202,HC_for_all_dinosaurs_using_HCoval_and_equation_.5.,209.1132473,0.262484245
729,Changchunsaurus_parvus,Changchunsaurus_parvus,Ornithischia,Ornithischia,Ornithischia,Late_Albian,Early_Cenomanian,,,,,,,,,,,,,67,Butler et al. 2011,immature; no neurocentral fusion: Butler et al 2011,1,0,"JLUM , Jilin University Geological Museum, Changchun, Jilin Province, China.",JLUM L0403-j-Zn2,,,,,,,,,,
730,Chaoyangsaurus_youngi,Chaoyangsaurus_youngi,Ornithischia,Ceratopsia,Ceratopsia_1,Late_Tithonian,Valanginian,,,,,,,,,,,,,,Zhao et al. 1999,Only skull known,0,0,"IG, Institute of Geology, Chinese Academy of Geological Sciences, Beijing, China",IGCAGS V371,,,,,,,,,,
731,Charonosaurus_jiayinensis,Charonosaurus_jiayinensis,Ornithischia,Hadrosauroidea,Hadrosauroidea,Late_Maastrichtian,Late_Maastrichtian,1350,,,,,,,,,,,,,"Godefroit et al. 2000, 2001","Unknown specimen number, holotype is only a skull; mature",0,1,,Referred Specimens,,,537.46,0.0417,FC_for_quadrupedal_iguanodontians_using_FL_and_equation_.30.,,,,,
732,Chasmosaurus_belli,Chasmosaurus_belli,Ornithischia,Ceratopsidae,Ceratopsidae,Late_Campanian,Late_Campanian,825,325,94.6,100,565,282,580,254,80.3,65.6,122.5,338.5,217.7,ROM 839 (NEC/MTC),mature,0,0,"ROM, Royal Ontario Museum, Toronto, Canada",ROM 839,305.74,229.76,325,0,measured,254,0,measured,3097.617496,0.153215359
733,Chasmosaurus_russelli,Chasmosaurus_russelli,Ornithischia,Ceratopsidae,Ceratopsidae,Late_Campanian,Late_Campanian,716,312,97.6,76.5,498,257,553,270,91,70.4,118,312,170,CMN 2280 (NEC); Mallon 2006; also Carrano dataset TMP 82.4.5 (cast of NMC 2280),skull length from Lull 1933; mature,0,0,"CMN, Canadian Museum of Nature, Ottawa, Canada",CMN 2280,274.48,254.56,312,0,measured,270,0,measured,3141.943443,0.153130193
734,Chungkingosaurus_jiangbeiensis,Chungkingosaurus_jiangbeiensis,Ornithischia,Stegosauria,Stegosauria,Oxfordian,Early_Kimmeridgian,670,,110,,487,,440,,91,,,,,Dong et al 1983,"humerus shaft round, diameters given; may not be the same species, but is a larger specimen than the holotype",0,0,"CV, Chongqing",CV 00205,,,316.29,0.0468,FC_for_quadrupedal_dinosaurs_using_FML_and_equation_.15.,263.47,0.0324,HC_for_quadrupedal_dinosaurs_using_HML_and_equation_.17.,3108.808849,0.236638931
735,Claosaurus_agilis,Claosaurus_agilis,Ornithischia,Hadrosauroidea,Hadrosauroidea,Late_Coniacian,Late_Coniacian,697,,,99,572,,360,,,46,,271,216,YPM 1190 (MTC); Lull and Wright 1942,immature; juvenile-shaped scapula: Carpenter et al. 1995,0,0,"YPM, Yale Peabody Museum, New Haven, Connecticut, USA",YPM 1190,,,258.26,0.0418,FC_for_quadrupedal_iguanodontians_using_FL_and_equation_.30.,170.46,0.0457,HC_for_quadrupedal_iguanodontians_using_HAP_and_equation_.34.,1355.912234,0.275523995
736,Coahuilaceratops_magnacuerna,Coahuilaceratops_magnacuerna,Ornithischia,Ceratopsidae,Ceratopsidae,Late_Campanian,Late_Campanian,,,,,,,,,,,,,,Loewen et al. 2010,unprepared postcranial elements; snout-quadrate length: 701; total length including frill: 1618,0,0,"CPC, Colección Paleontológica de Coahuila, Saltillo",CPC 276,,,,,,,,,,
737,Colepiocephale_lambei,Colepiocephale_lambei,Ornithischia,Pachycephalosauria,Pachycephalosauria,Middle_Campanian,Middle_Campanian,,,,,,,,,,,,,,Schott et al. 2009,Cranial domes only,0,0,"CMN, Canadian Museum of Nature, Ottawa, Canada",CMN 8818,,,,,,,,,,
738,Corythosaurus_casuarius,Corythosaurus_casuarius,Ornithischia,Hadrosauroidea,Hadrosauroidea,Late_Campanian,Late_Campanian,1080,,,130,1000,,585,,,,,,380,AMNH 5240 (MTC); Brown 1916,mature,0,0,"AMNH, American Museum of Natural History, New York, USA",AMNH 5240,,,419.67,0.0414,FC_for_quadrupedal_iguanodontians_using_FL_and_equation_.30.,236.08,0.0513,HC_for_quadrupedal_iguanodontians_using_HL_and_equation_.35.,4361.681338,0.312537114
739,Corythosaurus_intermedius,Corythosaurus_intermedius,Ornithischia,Hadrosauroidea,Hadrosauroidea,Late_Campanian,Late_Campanian,1058.8,365,86.6,108,940,370,536.3,237.5,79.5,69.2,146,635,370,ROM 845 (NEC/MTC); Evans 2010,mature,0,0,"ROM, Royal Ontario Museum, Toronto, Canada",ROM 845,306.6,233.86,365,0,measured,237.5,0,measured,3455.663476,0.152373503
740,Craspedodon_lonzeensis,not,Ornithischia,Iguanodontia,Iguanodontia,Santonian,Early_Campanian,,,,,,,,,,,,,,Godefroit and Lambert 2007,"isolated teeth, compare to Protoceratops hellenikorhinus",0,0,"IRSNB, Institut royal des Sciences naturelles de Belgique, Brussels, Belgium",IRSNB R59,,,,,,,,,,
741,Crichtonsaurus_benxiensis,Crichtonsaurus_benxiensis,Ornithischia,Ankylosauria,Ankylosauria,Cenomanian,Turonian,320,,49,,290,,230,,36,,,145,,Lu et al. 2007; BXGM V0012-1,,0,0,"BXGM, Benxi Geological Museum, Liaoning Province, China",BXGM V0012-1,,,154.18,0.0474,FC_for_quadrupedal_dinosaurs_using_FML_and_equation_.15.,113.92,0.0332,HC_for_quadrupedal_dinosaurs_using_HML_and_equation_.17.,373.0042803,0.229403328
742,Crichtonsaurus_bohlini,Crichtonsaurus_bohlini,Ornithischia,Ankylosauria,Ankylosauria,Cenomanian,Turonian,343,,67,,,,240,,51,,,,,Dong 2002,Total body length estmated at 3 m in the paper,0,0,"LPM, Liaoning Paleontological Museum, China",LPM 101,,,203.59,0.0471,FC_for_quadrupedal_dinosaurs_using_FML_and_equation_.15.,156.09,0.0328,HC_for_quadrupedal_dinosaurs_using_HML_and_equation_.17.,836.7146317,0.230477761
743,Cumnoria_prestwichii,Cumnoria_prestwichii,Ornithischia,Iguanodontia,Iguanodontia,Kimmeridgian,Kimmeridgian,,,,,,,297,,38,29,,,,Galton 1980a,immature; unfused braincase elements: Galton & Powell 1980,1,0,"OUMNH, Oxford University Museum of Natural History, Oxford, UK",OUMNH J.3303,,105.72,,,,110.08,0.0202,HC_for_all_dinosaurs_using_HCoval_and_equation_.5.,,
744,Dacentrurus_armatus,Dacentrurus_armatus,Ornithischia,Stegosauria,Stegosauria,Late_Kimmeridgian,Late_Kimmeridgian,1232,,165,,,,760,370,123,92,,575,,BMNH 46013 (RBJB),ulna and radius measurements from Galton 1985; femur is crushed,0,0,"BMNH, Natural History Museum, London, United Kingdom",BMNH 46013,,339.48,429.28,0.0274,FC_for_thyreophorans_using_HC_and_equation_.23.,370,0,measured,7515.970792,0.233433655
745,Dakotadon_lakotaensis,Dakotadon_lakotaensis,Ornithischia,Iguanodontia,Iguanodontia,Barremian,Barremian,,,,,,,,,,,,,,Weishampel and Bjork 1989,no limbs; skull length is an estimate,0,0,"SDSM, South Dakota School of Mines and Technology, Rapid City, South Dakota, USA",SDSM 8656,,,,,,,,,,
746,Delapparentia_turolensis,not,Ornithischia,Iguanodontia,Iguanodontia,Early_Barremian,Early_Barremian,,,,,,,,,,,,,,Ruiz-Omeñaca 2011,"no limbs; Illium length as preserved 780 mm, missing anterior more region",0,0,MPT,MPT/I.G.,,,,,,,,,,
747,Diabloceratops_eatoni,Diabloceratops_eatoni,Ornithischia,Ceratopsidae,Ceratopsidae,Early_Campanian,Middle_Campanian,,,,,,,,,,,,,,Kirkland & DeBlieux 2010,Skull only; mature,0,0,"UMNH, University of Utah Museum of Natural History, Salt Lake City, Utah, USA",UMNH VP 16699,,,,,,,,,,
748,Draconyx_loureiroi,not,Ornithischia,Iguanodontia,Iguanodontia,Tithonian,Tithonian,,,66,64,,,,,,,,,,ML 434 (MTC),,0,0,"ML, Lourinha Museum, Lourinha, Portugal",ML 434,204.22,,214.43,0.0245,FC_for_all_dinosaurs_using_FCoval_and_equation_.4.,,,,,
749,Dracopelta_zbyszewskii,not,Ornithischia,Ankylosauria,Ankylosauria,Late_Tithonian,Late_Tithonian,,,,,,,,,,,,,,Galton 1980b,"pelvis, partial ribcage, armour and foot",0,0,MIGM,SGP,,,,,,,,,,
750,Drinker_nisti,not,Ornithischia,Ornithischia,Ornithischia,Kimmeridgian,Tithonian,,,,,,,,,,,,,,Bakker et al. 1990,"no complete limbs, astragalus width 25.6 mm; subadult",1,0,"CPS, Colorado Palaeontographical Society, University Museum of the University of Colorado, USA",CPS 106,,,,,,,,,,
751,Dryosaurus_altus,Dryosaurus_altus,Ornithischia,Iguanodontia,Iguanodontia,Kimmeridgian,Tithonian,350,138,42.1,40.3,393,115,191,63,20.8,18.8,40,146.2,,YPM 1876 (NEC/MTC),immature; Osi et al. 2012,1,0,"YPM, Yale Peabody Museum, New Haven, Connecticut, USA",YPM 1876,129.45,62.24,138,0,measured,63,0,measured,168.9565248,0.151631044
752,Dyoplosaurus_acutesquamous,Dyoplosaurus_acutesquamous,Ornithischia,Ankylosauria,Ankylosauria,Middle_Campanian,Late_Campanian,562,273,103.2,45.8,,,,,,,119,240,108,"ROM 784 (DCE, MTC)",mature; Arbour et al 2009,0,0,"ROM, Royal Ontario Museum, Toronto, Canada",ROM 784,242.81,,273,0,measured,237.81,0.0265,HC_for_thyreophorans_using_FC_and_equation_.25.,2194.893461,0.222364932
753,Dysalotosaurus_lettowvorbecki,Dysalotosaurus_lettowvorbecki,Ornithischia,Iguanodontia,Iguanodontia,Late_Kimmeridgian,Tithonian,343,134,45,36,,,,,,,,,,BMNH R12777 (MTC),mature; Osi et al. 2012,0,0,"BMNH, Natural History Museum, London, United Kingdom",BMNH R12777,127.63,,134,0,measured,,,,,
754,Echinodon_becklesii,Echinodon_becklesii,Ornithischia,Ornithischia,Ornithischia,Berriasian,Berriasian,,,,,,,,,,,,,,jaws only,,0,0,"BMNH, Natural History Museum, London, United Kingdom","BMNH 48209, 48210",,,,,,,,,,
755,Edmontonia_longiceps,Edmontonia_longiceps,Ornithischia,Ankylosauria,Ankylosauria,Middle_Campanian,Middle_Campanian,663,276,,,558,,478,240,94.3,48.3,168,297.9,,CMN 8531 (NEC); Carpenter 1990,"Skull length was also estimate in Carpenter et al 2001 to 600mm (no sp# given); humerus anteroposteriorly crushed, diameter likely not good; femur too crushed to take diameter, circumference ok; mature",0,0,"CMN, Canadian Museum of Nature, Ottawa, Canada",CMN 8531,,229.86,276,0,measured,240,0,measured,2256.751309,0.149649279
756,Edmontonia_rugosidens,Edmontonia_rugosidens,Ornithischia,Ankylosauria,Ankylosauria,Late_Maastrichtian,Late_Maastrichtian,,,,,,,420,209,78.3,49.1,,,,ROM 1215 (DCE),mature; get measurements from ROM,0,0,"ROM, Royal Ontario Museum, Toronto, Canada",ROM 1215,,202.76,239.03,0.0272,FC_for_thyreophorans_using_HC_and_equation_.23.,209,0,measured,1530.505168,0.224047376
757,Edmontosaurus_annectens,Edmontosaurus_annectens,Ornithischia,Hadrosauroidea,Hadrosauroidea,Late_Maastrichtian,Late_Maastrichtian,1147.7,512.3,,140,968,381,680.5,250.5,84.7,64.7,160,621.5,407.5,AMNH 5730 (NEC/MTC),mature,0,0,"AMNH, American Museum of Natural History, New York, USA",AMNH 5730,,235.73,512.3,0,measured,250.5,0,measured,6610.07936,0.149990874
758,Edmontosaurus_regalis,Edmontosaurus_regalis,Ornithischia,Hadrosauroidea,Hadrosauroidea,Late_Campanian,Early_Maastrichtian,1242.5,532,147,146.5,1174,405,697.5,270,97.3,64.5,167,673,,CMN 2289 (NEC),"Skull length based on ROM 801, which has similarly sized limbs as CMN 2289; mature",0,0,"CMN, Canadian Museum of Nature, Ottawa, Canada",CMN 2289,461.03,256.77,532,0,measured,270,0,measured,7586.499866,0.153287599
759,Einiosaurus_procurvicornis,Einiosaurus_procurvicornis,Ornithischia,Ceratopsidae,Ceratopsidae,Middle_Campanian,Late_Campanian,644,,,,,,,,,,,,,Tumarkin-Deratzian 2009,All bonebed material; largest bonebed femur reported; a skull with basal length = 670 mm and total length = 1560 was listed by Sampson 1995; mature,0,1,"MOR, Museum of the Rockies, Bozeman, Montana, USA",MOR 456-8-9-6-1,,,265.92,0.0535,FC_for_quadrupedal_dinosaurs_using_FL_and_equation_.16.,,,,,
760,Elrhazosaurus_nigeriensis,Elrhazosaurus_nigeriensis,Ornithischia,Iguanodontia,Iguanodontia,Aptian,Albian,224,90,26.3,26.8,,,,,,,,,,MNHN GDF 332 (MTC),mature; Galton and Taquet 1982,0,0,"MNHN, Musee Nationale d'Histoire Naturelle, Paris, France",MNHN GDF 332,83.41,,90,0,measured,,,,,
761,Emausaurus_ernsti,Emausaurus_ernsti,Ornithischia,Thyreophora,Thyreophora,Early_Toarcian,Early_Toarcian,,,,,,,,,,,,,,Haubold 1990,no useful postcrania,1,0,SGWG,SGWG 85,,,,,,,,,,
762,Eocursor_parvus,Eocursor,Ornithischia,Ornithischia,Ornithischia,Norian,Rhaetian,109,,9.2,12.4,137,30,67,,,,,42,75,Butler et al. 2007; Butler 2010,,1,0,"SAM, South African Iziko Museum, Capetown, South Africa",SAM-PK-K8025,34.12,,36.93,0.0249,FC_for_all_dinosaurs_using_FCoval_and_equation_.4.,,,,4.155353374,0.163730307
763,Eolambia_caroljonesa,Eolambia_caroljonesa,Ornithischia,Hadrosauroidea,Hadrosauroidea,Late_Albian,Early_Cenomanian,,,,,,,,,,,,,,Kirkland 1998,mature; McDonald et al 2012,0,0,"CEUM, College of Eastern Utah Prehistoric Museum, Price, Utah, USA",CEUM 5212,,,,,,,,,,
764,Eotriceratops_xerinsularis,Eotriceratops_xerinsularis,Ornithischia,Ceratopsidae,Ceratopsidae,Early_Maastrichtian,Early_Maastrichtian,,,,,,,,,,,,,,Wu et al. 2007,Approximately 3 meters given in text as estimated total skull length. But this seems too big; mature,0,0,"TMP, Royal Tyrrell Museum of Paleontology, Drumheller, Canada",TMP 2002.57.07,,,,,,,,,,
765,Equijubus_normani,Equijubus_normani,Ornithischia,Hadrosauroidea,Hadrosauroidea,Barremian,Aptian,,,,,,,,,,,,,,You et al 2003b,no limbs,0,0,"IVPP, Institute of Vertebrate Paleontology and Paleoanthropology, Beijing, China",IVPP V12534,,,,,,,,,,
766,Euoplocephalus_tutus,Euoplocephalus_tutus,Ornithischia,Ankylosauria,Ankylosauria,Late_Campanian,Late_Campanian,547.5,278,,,411.5,263,415,244,82,,147,271,,AMNH 5404 (NEC/MTC/DCE),skull length of ROM specimen = 371; NEC: forelimb; MTC: hindlimb; DCE: radius; mature,0,0,"AMNH, American Museum of Natural History, New York, USA",AMNH 5404,,,278,0,measured,244,0,measured,2329.632228,0.151187481
767,Ferganocephale_adenticulatum,not,Ornithischia,Pachycephalosauria,Pachycephalosauria,Callovian,Callovian,,,,,,,,,,,,,,Averianov et al. 2005,"isolated teeth only; nomen dubium; tooth crown height: 6.75, basal length: 5.70",0,0,"ZIN PH, Paleoherpetological Collection, Zoological Institute, Russian Academy of Sciences, St. Petersburg, Russia",ZIN PH 34?42,,,,,,,,,,
768,Fruitadens_haagarorum,Fruitadens_haagarorum,Ornithischia,Ornithischia,Ornithischia,Early_Tithonian,Early_Tithonian,,19.6,,,71.8,,36.7,,2.7,,,,,Butler et al. 2009,Circumference from the adult femur (LACM 115727); mature; Butler et al 2009,0,0,"LACM, Los Angeles County Museum, California, USA",LACM 120478,,,19.6,0,measured,,,,0.72813701,0.135
769,Fukuisaurus_tetoriensis,Fukuisaurus_tetoriensis,Ornithischia,Hadrosauroidea,Hadrosauroidea,Barremian,Barremian,,,,,,,,,,,,,,Kobayashi and Azuma 2003,Only sternal plates preserved for postcranial skeleton; dentary length: 259.4; mature; probably: Kobayashi and Azuma 2003,0,0,"FPDM, Fukui Prefectural Dinosaur Museum, Fukui, Japan",FPDM-V-40,,,,,,,,,,
770,Gargoyleosaurus_parkpinorum,Gargoyleosaurus_parkpinorum,Ornithischia,Ankylosauria,Ankylosauria,Kimmeridgian,Tithonian,465,193,75,58,,,292,175,60,50,,,,Kilbourne and Carpenter 2005,"sk, post width: 235.5; mature; Kilbourne and Carpenter 2005",0,0,"DMNH, Denver Museum of Nature and Science, Denver, Colorado, UK",DMNH 27726,209.77,173.14,193,0,measured,175,0,measured,891.0089449,0.151915285
771,Gasparinisaura_cincosaltensis,Gasparinisaura_cincosaltensis,Ornithischia,Ornithischia,Ornithischia,Early_Campanian,Early_Campanian,,55,,,,,,,,,,,,MUCPv-219 (DCE),"Largest individual, incomplete; mature; Salgado et al 2007",0,0,"MUCP, Museo Argentino de Ciencas Naturales, Universidad Nacional del Comahue, Argentina",MUCPv-219,,,55,0,measured,,,,12.42196375,0.135
772,Gastonia_burgei,Gastonia_burgei,Ornithischia,Ankylosauria,Ankylosauria,Barremian,Barremian,590,258,,,300,,320,177,,,,,,John Bird and Ken Carpenter pers. comm. 12 November 2012; Gaston et al. 2001,"width of skull: 283; est total body length of 4.6m, reconstructed from bonebed material; mature; Gaston et al. 2001",0,1,"CEUM, College of Eastern Utah Prehistoric Museum, Price, Utah, USA",CEUM 3646,,,258,0,measured,177,0,measured,1411.220204,0.149837931
773,Gideonmantellia_amosanjuanae,Gideonmantellia_amosanjuanae,Ornithischia,Ornithischia,Ornithischia,Early_Barremian,Early_Barremian,112.9,,11.5,13.2,132,,,,,,,,60.9,Ruiz-Omenaca et al. 2012,immature; no neurocentral fusion in sacral vertebrae,1,0,"MPG, Museo Paleontológico de Galve, Spain",MPG-PBCH,38.84,,41.95,0.0248,FC_for_all_dinosaurs_using_FCoval_and_equation_.4.,,,,5.899140371,0.16426489
774,Gigantspinosaurus_sichuanensis,not,Ornithischia,Stegosauria,Stegosauria,Oxfordian,Early_Kimmeridgian,673,278,88,60,460,,435,235,70,65,,,,"S. Toru, pers. comm. 11 May 2012",,0,0,"ZDM, Zigong Dinosaur Museum, Zigong, China",ZDM 0019,234.56,212.13,278,0,measured,235,0,measured,2220.861952,0.152306707
775,Gilmoreosaurus_mongolensis,Gilmoreosaurus_mongolensis,Ornithischia,Hadrosauroidea,Hadrosauroidea,Middle_Campanian,Late_Campanian,695,280,,,615,234,315,142,,,86,309,,Humerus: AMNH FARB 30728; Femur: AMNH FARB 30741; Tibia: AMNH FABR 30746 (DCE),,0,1,"AMNH, American Museum of Natural History, New York, USA",AMNH FARB 30728/30741,,,280,0,measured,142,0,measured,1298.278492,0.151943179
776,Glyptodontopelta_mimus,not,Ornithischia,Ankylosauria,Ankylosauria,Early_Maastrichtian,Early_Maastrichtian,,,,,,,,,,,,,,Ford 2000; only scutes,,0,0,"USNM, United States National Museum, Washington DC, USA",USNM 8610,,,,,,,,,,
777,Gobisaurus_domoculus,Gobisaurus_domoculus,Ornithischia,Ankylosauria,Ankylosauria,Turonian,Turonian,,,,,,,,,,,,,,Vickaryous et al. 2001,"skull, post. Width:352; paper reports complete skeleton but gives no details",0,0,"IVPP, Institute of Vertebrate Paleontology and Paleoanthropology, Beijing, China",IVPP V12563,,,,,,,,,,
778,Gongbusaurus_wucaiwanensis,not,Ornithischia,Ornithischia,Ornithischia,Callovian,Oxfordian,110,39.3,,,124.3,,57.5,,7.4,,,46,68,"Xu Xing office specimen, number currently unknown (NEC)",,0,0,"IVPP, Institute of Vertebrate Paleontology and Paleoanthropology, Beijing, China",IVPP V8303,,,39.3,0,measured,,,,4.930322493,0.135
779,Goyocephale_lattimorei,Goyocephale_lattimorei,Ornithischia,Pachycephalosauria,Pachycephalosauria,Late_Campanian,Early_Maastrichtian,,,,,,,92,,,,,,,Perle et al. 1982,width of skull:135; length of ilium 230,0,0,GI,GI SPS 100/1201,,,,,,,,,,
780,Graciliceratops_mongoliensis,Graciliceratops_mongoliensis,Ornithischia,Ceratopsia,Ceratopsia_3,Cenomanian,Santonian,96,,10.2,10.8,110,,84.7,,7.1,,,60,,"Chinnery 2004b, ODP",7.1 in minimum shaft,0,0,"ZPAL, Institute of Paleobiology of the Polish Academy of Sciences, Warsaw, Poland",ZPAL MgD-I/156,32.99,,35.73,0.0249,FC_for_all_dinosaurs_using_FCoval_and_equation_.4.,26.25,0.0368,HC_for_quadrupedal_dinosaurs_using_HML_and_equation_.17.,6.653313705,0.193856722
