Index,Taxon,Name_in_tree,Clade,Subclade,Subclade_2,Max_age,Min_age,FL,FC,FML,FAP,TL_TLE,TC,HL,HC,HML,HAP,RC,RL_RLE,MtL,Source,Age/notes,Juvenile,Bonebed,Institution,Specimen,FCoval,HCoval,FCe,FCe_meserr,FCe_method,HCe,HCe_meserr,HCe_method,Mass,Mass_lse (log10)
441,Jianchangornis_microdonta,Jianchangornis,Theropoda,Avialae,Avialae,121,119.4,60,,,6,72.96,,76,,,,,80,36,Zhou et al. 2009,subadult,1,0,"IVPP, Institute of Vertebrate Paleontology and Paleoanthropology, Beijing, China",IVPP V16708,,,19.0465186,0.0501,FC_for_bipedal_dinosaurs_using_FAP_and_equation_.8.,,,,0.67299308,0.200360555
442,Jiangxisaurus_ganzhouensis,Jiangxisaurus,Theropoda,Oviraptorosauria,Oviraptorosauria,Campanian,Maastrichtian,,,,,,,136,,15,,,96,,Wei et al. 2013; HGM 41III0421,,0,0,"HGM, Henan Geological Museum",HGM 41III0421,,,,,,,,,,
443,Jibeinia_luanhera,not,Theropoda,Avialae,Avialae,Late_Barremian,Early_Aptian,22.2,,1.9,,26.88,,23.3,,,,,24.2,16.3,Hou 1997,,0,0,,,,,7.23,0.0399,FC_for_bipedal_dinosaurs_using_FML_and_equation_.6.,,,,0.046929368,0.17902158
444,Jinfengopteryx_elegans,Jinfengopteryx,Theropoda,Troodontidae,Troodontidae,Late_Barremian,Early_Aptian,70,,,7.5,101,,49,,,,,42,61,"Ji et al., 2005; anteroposterior femoral shaft thickness measured from figure; CAGS-IG-04-0801",,0,0,"CAGS, Chinese Academy of Geological Sciences, Institute of Geology, Beijing, China",CAGS-IG-04-0801,,,23.96730685,0.0497,FC_for_bipedal_dinosaurs_using_FAP_and_equation_.8.,,,,1.26590231,0.198543765
445,Jinzhouornis_zhangjiyingia,Jinzhouornis_zhangjiyingia,Theropoda,Avialae,Avialae,Late_Barremian,Early_Aptian,,,,,,,,,,,,,,,,0,0,,,,,,,,,,,,
446,Jixiangornis_orientalis,Jixianornis,Theropoda,Avialae,Avialae,Late_Barremian,Early_Aptian,71.9,,,7.1,83.2,,112,,,,,103.4,41.3,Ji et al. 2002; CDPC-02-04-001,,0,0,"CDPC, Changzhou Dinosaur Park of China",CDPC-02-04-001,,,22.65195002,0.0498,FC_for_bipedal_dinosaurs_using_FAP_and_equation_.8.,,,,1.083939313,0.198061266
447,Judinornis_nogontsavensis,not,Theropoda,Avialae,Avialae,Late_Campanian,Early_Maastrichtian,,,,,,,,,,,,,,"Nessov & Borkin 1983; in Russian, no figures",,0,0,,,,,,,,,,,,
448,Juravenator_starki,not,Theropoda,basal_coelurosaur,basal_coelurosaur,Late_Kimmeridgian,Late_Kimmeridgian,52,,,6,58,,27,,,,,19,34,Gohlich & Chiappe 2006,juvenile,1,0,"JME, Jura Museum, Eichstaatt",JME Sch 200,,,19.0465186,0.0501,FC_for_bipedal_dinosaurs_using_FAP_and_equation_.8.,,,,0.67299308,0.202363555
449,Kaijiangosaurus_lini,not,Theropoda,basal_theropod,basal_theropod,Bajocian,Callovian,400,,,,,,,,,,,,315,He 1984; CCG 20020—possibly a chimaera (OWM Rauhut pers. comm. 2009),,0,0,"CCG, Chengdu College of Geology, Chengdu, China",CCG 20020,,,126.47,0.0581,FC_for_bipedal_dinosaurs_using_FL_and_equations_.9...11.,,,,122.5754466,0.233101634
450,Kakuru_kujani,not,Theropoda,basal_theropod,basal_theropod,Aptian,Aptian,,,,,,,,,,,,,,distal tibia; Molnar & Pledge 1980,,0,0,"SAM, South Australian Museum",SAM P17926,,,,,,,,,,
451,Kelmayisaurus_petrolicus,not,Theropoda,Allosauroidea,Allosauroidea,Late_Aptian,Albian,,,,,,,,,,,,,,maxilla and dentary (523 mm long); Dong 1973; Brusatte et al. 2011,,0,0,"IVPP, Institute of Vertebrate Paleontology and Paleoanthropology, Beijing, China",IVPP V.4022,,,,,,,,,,
452,Khaan_mckennai,Khaan,Theropoda,Oviraptorosauria,Oviraptorosauria,Late_Campanian,Late_Campanian,185,,20,,212,,110.5,,,,,102,98,Balanoof & Norell 2012; IGM 100/1127,,0,0,"IGM, Institute of Geology, Ulaan Baatar, Mongolia",IGM 100/1127,,,67.62,0.0376,FC_for_bipedal_dinosaurs_using_FML_and_equation_.6.,,,,21.91978526,0.181216213
453,Kinnareemimus,not,Theropoda,Ornithomimosauria,Ornithomimosauria,Barremian,Aptian,,,,,254,,,,,,,,,Buffetaut et al. 2009,"juvenile, bonebed",1,1,PW,PW5A-100,,,65.88,0.0868,FC_for_bipedal_dinosaurs_using_TL_and_equations_.12...14.,,,,20.40374779,0.30599165
454,Kol_ghuva,Kol,Theropoda,Alvarezsauroidea,Alvarezsauroidea,Late_Campanian,Late_Campanian,,,,,,,,,,,,,225,Turner et al. 2009; IGM 100/2011,,0,0,"IGM, Institute of Geology, Ulaan Baatar, Mongolia",IGM 100/2011,,,,,,,,,,
455,Qiupalong_henanensis,not,Theropoda,Ornithomimosauria,Ornithomimosauria,Campanian,Maastrichtian,,,,,384,,,,,,,,,Xu et al. 2010; HGM 41HIII-0106,,0,0,"HGM, Henan Geological Museum, Zhengzhou, Henan Province, China",HGM 41HIII-0106,,,114.28,0.0864,FC_for_bipedal_dinosaurs_using_TL_and_equations_.12...14.,,,,92.76560704,0.311523872
456,Kizylkumavis_cretacea,not,Theropoda,Avialae,Avialae,NA,NA,,,,,,,,,,,,,,"Nessov 1984; in Russian, no figures",,0,0,,,,,,,,,,,,
457,Kryptops_palaios,not,Theropoda,Ceratosauria,Ceratosauria,Aptian,Albian,,,,,,,,,,,,,,partial maxilla only; Sereno & Brusatte 2008; Carrano et al. 2012,,0,0,"MNN, Musée National du Niger, Niamey, Republic of Niger",MNN GAD1,,,,,,,,,,
458,Kuszholia,not,Theropoda,Avialae,Avialae,NA,NA,,,,,,,,,,,,,,Vertebra,,0,0,,,,,,,,,,,,
459,Labocania_anomala,not,Theropoda,Tyrannosauroidea,Tyrannosauroidea,Campanian,Campanian,,,,,,,,,,,,,,skeletal fragments; Molnar 1974,,0,0,"LACM, Los Angeles County Museum, California, USA",LACM 20877,,,,,,,,,,
460,Laevisuchus_indicus,Laevisuchus,Theropoda,Ceratosauria,Ceratosauria,Maastrichtian,Maastrichtian,,,,,,,,,,,,,,3 cervicals and 1 dorsal vertebrae; Huene & Matley 1933,,0,0,"GSI, Geological Survey of India, Kolkata (Calcutta), India","GSI K20/614, K20/613, K27/696",,,,,,,,,,
461,Lametasaurus_indicus,not,Theropoda,Ceratosauria,Ceratosauria,Maastrichtian,Maastrichtian,,,,,580,355,,,,,,,,Matley 1924,,0,0,,,,,430.62,0.0426,FC_for_bipedal_dinosaurs_using_TC_and_equation_.7.,,,,3558.947286,0.206066106
462,Lectavis_bretincola,not,Theropoda,Avialae,Avialae,Late_Campanian,Maastrichtian,,,,,,,,,,,,,88,"Chiappe 1993; PVL 4021, tarsometatarsus, proximal width 15, distal width 14.3",,0,0,"PVL, Fundación-Instituto Miguel Lillo, Universidad Nacional de Tucumán, Tucumán, Argentina",PVL 4021,,,,,,,,,,
463,Lenesornis_maltshavskyi,not,Theropoda,Avialae,Avialae,NA,NA,,,,,,,,,,,,,,partial synsacrum,,0,0,,,,,,,,,,,,
464,Leptorhynchos,Leptorhynchos,Theropoda,Oviraptorosauria,Oviraptorosauria,Late_Campanian,Late_Campanian,,,,,,,,,,,,,161,"ROM 781, tarsometatarsus",,0,0,"ROM, Royal Ontario Museum, Toronto, Canada",ROM 781,,,,,,,,,,
465,Leshansaurus_qianweiensis,Leshansaurus,Theropoda,Megalosauroidea,Megalosauroidea,Oxfordian,Early_Kimmeridgian,600,,74,,580,,,,,,,,,Li et al. 2009; femoral mediolateral shaft width measured from figure; QW 200701,,0,0,"QW, Giant Buddha Temple Museum, Leshan, China",QW 200701,,,234.24,0.0376,FC_for_bipedal_dinosaurs_using_FML_and_equation_.6.,,,,667.2935579,0.186084925
466,Liaoningornis_longiditris,Liaoningornis,Theropoda,Avialae,Avialae,Late_Barremian,Early_Aptian,27,,2.35,,32.2,,,,,,,,15.4,Hou 1997; O'Connor 2012; IVPP V11303,unknown ontogenetic stage,0,0,"IVPP, Institute of Vertebrate Paleontology and Paleoanthropology, Beijing, China",IVPP V11303,,,8.85,0.0397,FC_for_bipedal_dinosaurs_using_FML_and_equation_.6.,,,,0.081817547,0.181980604
467,Ligabueino_andesi,not,Theropoda,Ceratosauria,Ceratosauria,Barremian,Early_Aptian,64,15,5.2,,,,,,,,,,,MACN-N 42 (DE); Bonaparte 1996; MACN-N 42; anteroposterior femoral diameter estimated based on proportions of Masiakasaurus,juvenile,1,0,"MACN, Museo Argentino de Ciencias Naturales, Buenos Aires, Argentina",MACN-N 42,,,15,0,measured,,,,0.34901316,0.135
468,Liliensternus_liliensterni,Liliensternus,Theropoda,basal_theropod,basal_theropod,Rhaetian,Rhaetian,424,110,31.1,37.8,414.5,101,200,,,,,150,220,Huene 1934; HMN R1291(larger individual),,0,0,"MB, Museum für Naturkunde, Berlin, Germany",MB R1291,108.48,,110,0,measured,,,,83.52383562,0.135
469,Limenavis_patagonica,Limenavis,Theropoda,Avialae,Avialae,Late_Campanian,Early_Maastrichtian,,,,,,,,,,,,,,Clarke & Chiappe 2001; pectoral limb fragments,,0,0,,,,,,,,,,,,
470,Limusaurus_inextricabilis,Limusaurus,Theropoda,Ceratosauria,Ceratosauria,Oxfordian,Oxfordian,210,,,20,239.04,,85,,,,,45,155,IVPP V 15923 (JNC); Xu et al. 2009; femoral anteroposterior shaft diameter measured from figure; femoral mediolateral diameter estimated based on proportions of Masiakasaurus,,0,0,"IVPP, Institute of Vertebrate Paleontology and Paleoanthropology, Beijing, China",IVPP V 15923,,,65.81227274,0.0485,FC_for_bipedal_dinosaurs_using_FAP_and_equation_.8.,,,,20.34613079,0.203079746
471,Linhenykus_monodactylus,Linhenykus,Theropoda,Alvarezsauroidea,Alvarezsauroidea,Late_Campanian,Late_Campanian,70,,8,,97.5,,,,,,,,71,Xu et al. 2011; IVPP V17608,,0,0,"IVPP, Institute of Vertebrate Paleontology and Paleoanthropology, Beijing, China",IVPP V17608,,,28.32,0.0381,FC_for_bipedal_dinosaurs_using_FML_and_equation_.6.,,,,2.002869311,0.184555944
472,Linheraptor_exquisitus,not,Theropoda,Dromaeosauridae,Dromaeosauridae,Late_Campanian,Late_Campanian,225,,,,255,,157,,,,,106,125,IVPP V16923 (JNC),,0,0,"IVPP, Institute of Vertebrate Paleontology and Paleoanthropology, Beijing, China",IVPP V16923,,,65.95,0.0582,FC_for_bipedal_dinosaurs_using_FL_and_equations_.9...11.,,,,20.46340723,0.230718549
473,Lonchodytes_estesi,not,Theropoda,Avialae,Avialae,Late_Maastrichtian,Late_Maastrichtian,,,,,,,,,,,,,,"Brodkorb 1963; distal tarsometatarsus only, maximum width = 12.5 mm",,0,0,,,,,,,,,,,,
474,Longchengornis_sanyanensis,not,Theropoda,Avialae,Avialae,121,119.4,26,,2.6,,32.64,,27.6,,12,,,29,23,Hou 1997; IVPP V10530; measured from figure,,0,0,"IVPP, Institute of Vertebrate Paleontology and Paleoanthropology, Beijing, China",IVPP V10530,,,9.74,0.0395,FC_for_bipedal_dinosaurs_using_FML_and_equation_.6.,,,,0.106478087,0.177896625
475,Longipteryx_chaoyangensis,Longipteryx,Theropoda,Avialae,Avialae,121,119.4,30,,,3.2,28.896,,43,,,,,45,20,Zhang et al. 2001; Zhou et al. 2006; O'Connor et al. 2011,,0,0,"IVPP, Institute of Vertebrate Paleontology and Paleoanthropology, Beijing, China",IVPP V12325,,,9.969258089,0.0516,FC_for_bipedal_dinosaurs_using_FAP_and_equation_.8.,,,,0.113511219,0.198215274
476,Longirostravis_hani,Longirostravis,Theropoda,Avialae,Avialae,Late_Barremian,Early_Aptian,20,,1.8,,24.096,,24,,,,,25,14,Hou et al 2004; O'Connor et al. 2011,,0,0,"IVPP, Institute of Vertebrate Paleontology and Paleoanthropology, Beijing, China",IVPP V11309,,,6.87,0.0401,FC_for_bipedal_dinosaurs_using_FML_and_equation_.6.,,,,0.040781299,0.180210314
477,Lophostropheus_airlensis,not,Theropoda,basal_theropod,basal_theropod,Rhaetian,Hettangian,,,,,,,,,,,,,,"fragmentary pubis and ilium, plus vertebrae; Larsonneur & Lapparent 1966; Ezcurra & Cuny 2007",,0,0,,,,,,,,,,,,
478,Lourinhanosaurus_antunesi,not,Theropoda,Allosauroidea,Allosauroidea,Late_Kimmeridgian,Early_Tithonian,430,161,50,46,,155,,,,,,,,ML 370,,0,0,"ML, Lourinha Museum, Lourinha, Portugal",ML 370,150.86,,161,0,measured,,,,238.0318244,0.135
479,Luanchuanraptor_henanensis,not,Theropoda,Dromaeosauridae,Dromaeosauridae,Campanian,Maastrichtian,,,,,,,174,,,,,,,measured from figures in Lü et al. 2007,,0,0,"HGM, Henan Geological Museum","HGM, 41HIII-0100",,,,,,,,,,
480,Magnosaurus_nethercombensis,Magnosaurus,Theropoda,Megalosauroidea,Megalosauroidea,Early_Bajocian,Early_Bajocian,,,,,,,,,,,,,,"Benson, 2010b (estimated from Piatnitzkysaurus tibia)",,0,0,"OUMNH, Oxford University Museum of Natural History, Oxford, UK",OUMNH J.12143,,,,,,,,,,
481,Mahakala_omnogovae,Makhala,Theropoda,Dromaeosauridae,Dromaeosauridae,Late_Campanian,Late_Campanian,79,19.93,6,,110,,37.5,,,,,36,82,Butler et al. 2009; Turner et al. 2011; IGM 100/1033,,0,0,"IGM, Institute of Geology, Ulaan Baatar, Mongolia",IGM 100/1033,,,19.93,0,measured,,,,0.76234028,0.135
482,Majungasaurus_crenatissimus,Majungasaurus,Theropoda,Ceratosauria,Ceratosauria,Maastrichtian,Maastrichtian,,323,,,,218,,,,,,,250,Estimated from FMNH PR 2278 in Carrano (2007),,0,0,"FMNH, Field Museum of Natural History, Chicago, U.S.A",,,,323,0,measured,,,,1614.200721,0.135
483,Majungasaurus_crenatissimus,not,Theropoda,Ceratosauria,Ceratosauria,Maastrichtian,Maastrichtian,,,,,,,207,,,,,55,,Birch & Carrano 2012; FMNH PR 2836,,0,0,"FMNH, Field Museum of Natural History, Chicago, U.S.A",,,,,,,,,,,
484,Mapusaurus_roseae,Mapusaurus,Theropoda,Allosauroidea,Allosauroidea,Late_Cenomanian,Turonian,1300,455,,,,,300,,,,,,,Coria & Currie 2006,bonebed,0,1,"MCF-PVPH, Museo ""Carmen Funes"", Plaza Huincul, Neuquen Province, Argentina",MCF-PVPH-108,,,455,0,measured,,,,4140.730705,0.135
485,Marshosaurus_bicentesimus,Marshosaurus,Theropoda,Megalosauroidea,Megalosauroidea,Kimmeridgian,Tithonian,,,,,,,,,,,,,,Pubis length (420 mm; UMNH VP 6387) slightly shorter than Piatnitzkysaurus,,0,0,"UMNH, DMNH, CM",UMNH VP 6387,,,,,,,,,,
486,Martinavis,not,Theropoda,Avialae,Avialae,Late_Campanian,Early_Maastrichtian,,,,,,,,,,,,,,,,0,0,,,,,,,,,,,,
487,Martinavis,not,Theropoda,Avialae,Avialae,Maastrichtian,Maastrichtian,,,,,,,,,,,,,,,,0,0,,,,,,,,,,,,
488,Masiakasaurus_knopfleri,Masiakasaurus,Theropoda,Ceratosauria,Ceratosauria,Maastrichtian,Maastrichtian,202,65,18,18.3,205,,,,,,,,,"Carrano et al. 2002, 2011; largest femur: UA 8684",bonebed,0,1,"UA, Université d'Antananarive, Antananarivo, Madagascar",UA 8684,57.02,,65,0,measured,,,,19.66316495,0.135
489,Megalosaurus_bucklandii,Megalosaurus,Theropoda,Megalosauroidea,Megalosauroidea,Early_Bathonian,Middle_Bathonian,830,310,,,660,238,388,191,,,,,,"Benson 2009, 2010: multiple different specimens from Stonesfield",bonebed',0,1,"BMNH, Natural History Museum, London, United Kingdom",,,,310,0,measured,191,0,measured,1441.809364,0.135
490,Megaraptor_namunhuaiquii,Megaraptor,Theropoda,Allosauroidea,Allosauroidea,Late_Turonian,Early_Coniacian,,,,,,,,,,,,283,,Novas 1998,,0,0,"MCF-PVPH, Museo ""Carmen Funes"", Plaza Huincul, Neuquen Province, Argentina",MCF-PVPH 79,,,,,,,,,,
491,Megaraptor_namunhuaiquii,not,Theropoda,Allosauroidea,Allosauroidea,Late_Turonian,Early_Coniacian,,,,,,,,,,,,243,,"Calvo et al 2004; MUCPv 341 (JNC, RBJB)",,0,0,"MUCP, Museo Argentino de Ciencas Naturales, Universidad Nacional del Comahue, Argentina",MUCPv 341,,,,,,,,,,
492,Mei_long,Mei,Theropoda,Troodontidae,Troodontidae,Late_Barremian,Early_Aptian,77,20.7,6,,100.5,,43.6,,3.6,2.8,,39,58,IVPP V12733 (CS); Xu & Norell 2004; IVPP V12733,,0,0,"IVPP, Institute of Vertebrate Paleontology and Paleoanthropology, Beijing, China",IVPP V12733,,10.09,20.7,0,measured,,,,0.846078452,0.135
493,Metriacanthosaurus_parkeri,Metriacanthosaurus,Theropoda,Allosauroidea,Allosauroidea,Early_Oxfordian,Early_Oxfordian,850,296,,,,,,,,,,,,"OUMNH J.12144 (MTC, RBJB)",,0,0,"OUMNH, Oxford University Museum of Natural History, Oxford, UK",OUMNH J.12144,,,296,0,measured,,,,1269.783105,0.135
494,Microraptor_gui,Microraptor_gui,Theropoda,Dromaeosauridae,Dromaeosauridae,121,119.4,106,,,7.8,128.64,,88,,,,,79,68,IVPP V13352 (JNC); Xu et al. 2003; femoral anteroposterior shaft diameter measured from figure,,0,0,"IVPP, Institute of Vertebrate Paleontology and Paleoanthropology, Beijing, China",IVPP V13352,,,24.95520666,0.0496,FC_for_bipedal_dinosaurs_using_FAP_and_equation_.8.,,,,1.414582041,0.19912182
495,Microraptor_zhaoianus,Microraptor_zhaoianus,Theropoda,Dromaeosauridae,Dromaeosauridae,121,119.4,75,,4.3,5.1,90.24,,62,,,,,48,47.7,Xu et al 2000; Hwang et al. 2002; CAGS 20-7-004 (largest relatively complete complete specimen); ilium and femoral ap shaft diameter from CAGS 20-8-001 (similar size),,0,0,"CAGS, Chinese Academy of Geological Sciences, Institute of Geology, Beijing, China","CAGS 20-7-004, 001",14.79,,16.24,0.0253,FC_for_all_dinosaurs_using_FCoval_and_equation_.4.,,,,0.434188264,0.16304164
496,Microvenator_celer,Microvenator,Theropoda,Oviraptorosauria,Oviraptorosauria,Albian,Albian,124,37.5,10.7,11.2,,37.3,81.5,,,,,76,,Makovicky & Sues 1998; AMNH 3041,juvenile,1,0,"AMNH, American Museum of Natural History, New York, USA",AMNH 3041,34.4,,37.5,0,measured,,,,4.334072391,0.135
497,Mirischia_asymmetrica,not,Theropoda,basal_coelurosaur,basal_coelurosaur,Early_Albian,Early_Albian,165,,12.1,14.7,,,,,,,,,,Martill et al. 2000; Naish et al. 2004; SMNK 2349 PAL,,0,0,"SMNK, Staatliches Museum für Naturkunde Karlsruhe, Germany",SMNK 2349 PAL,42.2,,45.51,0.0248,FC_for_all_dinosaurs_using_FCoval_and_equation_.4.,,,,7.379801391,0.164834908
498,Monolophosaurus_jiangi,Monolophosaurus,Theropoda,basal_theropod,basal_theropod,Callovian,Callovian,,,,,,,,,,,,,,"Zhao & Currie, 1994; Zhao et al., 2010; femoral length scaled down from 'D.' sinensis by comparing the pubes.",,0,0,"IVPP, Institute of Vertebrate Paleontology and Paleoanthropology, Beijing, China",IVPP 84019,,,,,,,,,,
499,Mononykus_olecranus,Mononykus,Theropoda,Alvarezsauroidea,Alvarezsauroidea,Late_Campanian,Early_Maastrichtian,139,38.5,10.3,11.5,168,35.5,37,,,,,18.2,,Perle et al. 1994; Longrich & Currie 2009a; Choniere et al. 2010; GIN 107/6,,0,0,"GIN, Geological Institute, Mongolian Academy of Sciences, Ulaan Baatar, Mongolia",GIN 107/6,34.27,,38.5,0,measured,,,,4.65928332,0.135
500,Nanantius_eos,not,Theropoda,Avialae,Avialae,Albian,Albian,,,,,,,,,,,,,,Molnar 1986; QM F12992; left tibiotarsus,,0,0,"QM, Queensland Museum, Brisbane, Australia",QM F12992,,,,,,,,,,
501,Nankangia_jianxiensis,Nankangia,Theropoda,Oviraptorosauria,Oviraptorosauria,Campanian,Maastrichtian,370,,39,,400,,240,,,,,,,Lü et al. 2013; GMNH F10003,,0,0,GMNH,GMNH F10003,,,127.5,0.0375,FC_for_bipedal_dinosaurs_using_FML_and_equation_.6.,,,,125.339608,0.180656091
502,Nanshiungosaurus_brevispinus,Nanshiungosaurus,Theropoda,Therizinosauria,Therizinosauria,Campanian,Maastrichtian,,,,,,,,,,,,,,"mainly vertebrae, partial pelvis figured without scale; Dong 1979",,0,0,NIGP,NIGP V.4731,,,,,,,,,,
503,Nanshiungosaurus_bohlini,not,Theropoda,Therizinosauria,Therizinosauria,Barremian,Aptian,,,,,,,,,,,,,,Dong & Yu 1997; IVPP V.11116,,0,0,"IVPP, Institute of Vertebrate Paleontology and Paleoanthropology, Beijing, China",IVPP V.11116,,,,,,,,,,
504,Nedcolbertia_justinhoffmani,not,Theropoda,basal_coelurosaur,basal_coelurosaur,Barremian,Barremian,144.8,,18.2,,198.9,,,,,,,,107.4,TMP 96.90.2 (cast of CEUM 5071); Kirkland et al. 1998,,0,0,"TMP, Royal Tyrrell Museum of Paleontology, Drumheller, Canada",TMP 96.90.2,,,61.82,0.0376,FC_for_bipedal_dinosaurs_using_FML_and_equation_.6.,,,,17.13017533,0.180421314
505,Neimongosaurus_yangi,Neimongosaurus,Theropoda,Therizinosauria,Therizinosauria,Middle_Campanian,Late_Campanian,366,,45,,310,,222,,,,,180,116,"Zhang et al. 2001; femoral shaft mediolateral diameter measured from figure; LH V0001 (Long Hao Geologic Paleontological Research Center, Hohot, China)",,0,0,"LH, Long Hao Geologic and Paleontological Research Center, Department of Land Resources of Nei Mongol, Hohhot, China",LH V0001,,,146.05,0.0375,FC_for_bipedal_dinosaurs_using_FML_and_equation_.6.,,,,182.0845139,0.182097082
506,Nemegtomaia_barsboldi,Nemegtomaia,Theropoda,Oviraptorosauria,Oviraptorosauria,Late_Campanian,Early_Maastrichtian,,,,,,,,,,,,,,Lu et al. 2004; GIN 100/2112,,0,0,"GIN, Geological Institute, Mongolian Academy of Sciences, Ulaan Baatar, Mongolia",GIN 100/2112,,,,,,,,,,
507,Neogaeornis_wetzeli,not,Theropoda,Avialae,Avialae,Early_Campanian,Late_Maastrichtian,,,,,,,,,,,,,63,Olson 1992; GPMK 123; tarsometatarsus,,0,0,GPMK,GPMK 123,,,,,,,,,,
508,Neovenator_salerii,Neovenator,Theropoda,Allosauroidea,Allosauroidea,Barremian,Barremian,730,273,90,76,680,227,,,,,,,,"BMNH R10001, MIWG 6348 (single individual, two institutions); Brusatte et al., 2008",,0,0,"MIWG, Dinosaur Isle Museum of Isle of Wight Geology, Sandown, UK",,261.22,,273,0,measured,,,,1016.598337,0.135
509,Neuquenornis_volans,Neuquenornis,Theropoda,Avialae,Avialae,Santonian,Santonian,,,,4.8,84.192,,,,4.6,,,70.5,,Chiappe & Calvo 1994; Chiappe 1996,,0,0,"MUCP, Museo Argentino de Ciencas Naturales, Universidad Nacional del Comahue, Argentina",MUCPv-142,,,15.13602981,0.0506,FC_for_bipedal_dinosaurs_using_FAP_and_equation_.8.,,,,0.357784074,0.199942734
510,Neuquenraptor_argentinus,not,Theropoda,Dromaeosauridae,Dromaeosauridae,Late_Turonian,Early_Coniacian,265,,28,26.5,,,,,,,,,,measured from figures in Novas & Pol 2005; MCF PVPH 77,,0,0,"MCF-PVPH, Museo ""Carmen Funes"", Plaza Huincul, Neuquen Province, Argentina",MCF PVPH 77,85.62,,91.24,0.0246,FC_for_all_dinosaurs_using_FCoval_and_equation_.4.,,,,49.9513617,0.165896062
511,Noasaurus_leali,Noasaurus,Theropoda,Ceratosauria,Ceratosauria,Late_Campanian,Maastrichtian,,,,,,,,,,,,,,metatarsus similar length to Masiakasaurus; Bonaparte & Powell 1980,,0,0,"PVL, Fundación-Instituto Miguel Lillo, Universidad Nacional de Tucumán, Tucumán, Argentina",PVL 4061,,,,,,,,,,
512,Noguerornis_gonzalezi,not,Theropoda,Avialae,Avialae,Late_Hauterivian,Early_Barremian,,,,,,,23,,,,,23,,"Lacasa Ruiz 1989; LP.1702 P, a partial skeleton (humeri, radii, one ulna, three metacarpals, one rib, three vertebrae, furcula, and feather impressions)",,0,0,"LP, collection from “La Pedrera,” Institut d’Estudis Ilerdencs, Lleida, Spain",LP.1702 P,,,,,,,,,,
513,Nomingia_gobiensis,Nomingia,Theropoda,Oviraptorosauria,Oviraptorosauria,Late_Campanian,Early_Maastrichtian,285,82,,,355,,,,,,,,,MPC-D 100/119 (DE & NC),,0,0,MPC,MPC-D 100/119,,,82,0,measured,,,,37.24419749,0.135
514,Nothronychus_graffami,Nothronychus_graffami,Theropoda,Therizinosauria,Therizinosauria,Late_Cenomanian,Turonian,696,289,121,,650,,424,,,,,275,232,"UMNH VP 16420 (femoral circumference from Serjoscha (""Yoshi"") Evers, pers. comm. 15 December 2011); Zanno et al. 2009; UMNH VP 16420",,0,0,"UMNH, University of Utah Museum of Natural History, Salt Lake City, Utah, USA",UMNH VP 16420,,,289,0,measured,,,,1188.923024,0.135
515,Nothronychus_mckinleyi,Nothronychus_mckinleyi,Theropoda,Therizinosauria,Therizinosauria,Early_Turonian,Middle_Turonian,,,,,631,,418,,,,,257,,Kirkland & Wolfe 2001; MSM P-2117; tibia slightly shorter than N. graffami.,,0,0,"MSM, Paleontological collections of Mesa Southwest Museum, Mesa, Arizona",MSM P-2117,,,221.53,0.0866,FC_for_bipedal_dinosaurs_using_TL_and_equations_.12...14.,,,,572.4078918,0.315770042
516,Nqwebasaurus_thwazi,Nqwebasaurus,Theropoda,Ornithomimosauria,Ornithomimosauria,Berriasian,Valanginian,118,,,12,140.7,,58.5,,,,,44.2,72.7,De Klerk et al. 2000; femoral shaft anteroposterior diameter measured from figure; AM 6040,probably an immature individual,1,0,"AM, Albany Museum, Grahamstown, South Africa",AM 6040,,,38.88964682,0.049,FC_for_bipedal_dinosaurs_using_FAP_and_equation_.8.,,,,4.790077351,0.200839719
517,Nuthetes_destructor,not,Theropoda,Dromaeosauridae,Dromaeosauridae,Berriasian,Berriasian,,,,,,,,,,,,,,dentaries; Milner 2002,,0,0,,,,,,,,,,,,
518,Omnivoropteryx_sinousaorum,not,Theropoda,Avialae,Avialae,121,119.4,61,,,4.8,64.32,,100,,,,,,35,Czerkas & Ji 2002; CAGS02-IG-gausa-3/DM 609,,0,0,"CAGS, Chinese Academy of Geological Sciences, Institute of Geology, Beijing, China",CAGS02-IG-gausa-3/DM 609,,,15.13602981,0.0506,FC_for_bipedal_dinosaurs_using_FAP_and_equation_.8.,,,,0.357784074,0.200218172
519,Orkoraptor_burkei,not,Theropoda,Allosauroidea,Allosauroidea,Middle_Cenomanian,Turonian,,,,,,,,,,,,,,"skull fragments, vertebrae, partial tibia; Novas et al. 2008",,0,0,"MPM, Museo Padre Molina, Río Gallegos, Santa Cruz",MPM-Pv 3457,,,,,,,,,,
520,Ornitholestes_hermanni,Ornitholestes,Theropoda,basal_coelurosaur,basal_coelurosaur,Kimmeridgian,Tithonian,,58,,,162,42,132,,,,,81,119,AMNH 619 (JNC); Carpenter et al. 2005,,0,0,"AMNH, American Museum of Natural History, New York, USA",AMNH 619,,,58,0,measured,,,,14.37485842,0.135
521,Ornithomimus_edmontonicus,Ornithomimus,Theropoda,Ornithomimosauria,Ornithomimosauria,Late_Campanian,Early_Maastrichtian,495,145,47.8,,,,,,,,,,,MTC measurements: AMNH 5884,,0,0,"AMNH, American Museum of Natural History, New York, USA",AMNH 5884,,,145,0,measured,,,,178.5081025,0.135
522,Ornithomimus_edmontonicus,not,Theropoda,Ornithomimosauria,Ornithomimosauria,Late_Campanian,Early_Maastrichtian,435,110,25.3,29.2,456,84,276,,,,,190,310,"Russell 1972; ROM 851 (PJC, NC, MTC)",,0,0,"ROM, Royal Ontario Museum, Toronto, Canada",ROM 851,85.72,,110,0,measured,,,,83.52383562,0.135
523,Otogornis_genghisi,Otogornis,Theropoda,Avialae,Avialae,Hauterivian,Early_Aptian,,,,,,,39.4,,3.54,,,45.5,,"Hou 1994; IVPP V 9607, forelimb",,0,0,"IVPP, Institute of Vertebrate Paleontology and Paleoanthropology, Beijing, China",IVPP V 9607,,,,,,,,,,
524,Oviraptor_philoceratops,Oviraptor,Theropoda,Oviraptorosauria,Oviraptorosauria,Late_Campanian,Late_Campanian,,,,,,,,,,,,,,AMNH 6517,,0,0,"AMNH, American Museum of Natural History, New York, USA",AMNH 6517,,,,,,,,,,
525,Ozraptor_subotaii,not,Theropoda,basal_coelurosaur,basal_coelurosaur,NA,NA,,,,,,,,,,,,,,Long & Molnar 1998; UWA 82469; isolated distal tibia,,0,0,UWA,UWA 82469,,,,,,,,,,
526,Palintropus_retusus,not,Theropoda,Avialae,Avialae,Late_Maastrichtian,Late_Maastrichtian,,,,,,,,,,,,,,Hope 2002; coracoid,,0,0,"YPM, Yale Peabody Museum, New Haven, Connecticut, USA",YPM 513,,,,,,,,,,
527,Parahesperornis_alexi,Parahesperornis,Theropoda,Avialae,Avialae,Coniacian,Santonian,,,,,,,,,,,,,97,Martin 1984; KUVP 2287; Bell & Everhart 2009; FHSM VP-17312 ,,0,0,"FHSM, Fort Hays Sternberg Museum, Fort Hays, Kansas, USA",FHSM VP-17312,,,,,,,,,,
528,Paraprotopteryx_gracilis,not,Theropoda,Avialae,Avialae,Late_Barremian,Early_Aptian,22.2,,,1.6,26.3,,22.6,,,,,22,15.7,Zheng et al 2007,,0,0,Tianyu Natural Museum STM,STM V001,,,4.882524661,0.0538,FC_for_bipedal_dinosaurs_using_FAP_and_equation_.8.,,,,0.015948023,0.198875274
529,Parvicursor_remotus,Parvicursor,Theropoda,Alvarezsauroidea,Alvarezsauroidea,Late_Campanian,Late_Campanian,52.6,,3.1,3.3,72.96,,,,,,,,56,Karhu & Rautian 1996; PIN 4487/25,,0,0,"PIN, Paleontological Institute, Russian Academy of Sciences, Moscow, Russia",PIN 4487/25,10.06,,11.12,0.0256,FC_for_all_dinosaurs_using_FCoval_and_equation_.4.,,,,0.153274774,0.161881626
530,Pasquiaornis,not,Theropoda,Avialae,Avialae,Cenomanian,Cenomanian,,,,,,,,,,,,,,two species known from tarsometatarsi,,0,0,,,,,,,,,,,,
